{
  "export_schema_version": 1,
  "generated_at": "2026-09-29T21:00:00Z",
  "generated_by": {
    "tool": "bloomctl",
    "version": "0.1.0a7"
  },
  "selection": {
    "experiment_ids": [12880747],
    "scan_ids": [
      12894739, 12894740, 12894741, 12894742, 12894743, 12894744, 12894745, 12894746, 12894747,
      12894748, 12894749, 12894750, 12894751
    ],
    "filters": {
      "plant_age_days": 7
    },
    "scan_ids_sha256": "a4d958750483fbad57775bf975c40681e62d798b63d49a161290a9ed8ed70ef3"
  },
  "recipe": {
    "recipe_key": "a0700eca4b3eeb01201008328818815d0f1e2d3c4b5a69788796a5b4c3d2e1f0",
    "recipe_key_version": 1,
    "recipe_kind": "pipeline",
    "chosen_by": "default",
    "definition": {
      "models": [
        ["org/registry/canola-lateral", "v0", "75e1b1e7671e0b0c01176165ed6f4076"],
        ["org/registry/canola-primary", "v0", "a6b27968b01c7640335359d2539a8ae3"]
      ],
      "predict_code_sha": "9a6f20c00762e327b9aea39c8e06a81443252d01",
      "predict_output_params": {
        "peak_threshold": 0.2
      },
      "traits_code_sha": "e373b0f92639ce13feb90d619b9fd14172ce296d"
    },
    "observed": {
      "contract_versions": ["0.1.0a9"],
      "traits_sleap_roots_versions": ["0.1.4"],
      "sleap_nn_versions": ["0.3.0"],
      "predict_container_digests": [
        "sha256:afc8da823838bff85d93013e85b8d0c18c2d4f01117a0914944df1a845c73adc"
      ],
      "traits_container_digests": [
        "sha256:2cbbe602b7d397b89c4eab326d00f410f367f8c1b7fba46a927a369fcf6fc9a4"
      ],
      "inference_configs": [
        {
          "batch_size": 4,
          "device": "cpu",
          "peak_threshold": 0.2
        }
      ]
    }
  },
  "included": {
    "n_scans": 12,
    "source_ids": [219, 220, 221, 222, 223, 224, 225, 226, 227, 228, 229, 230]
  },
  "excluded": [
    {
      "scan_id": 12894751,
      "plant_qr_code": "qr-example-1",
      "reason": "no_traits",
      "available_recipes": []
    }
  ],
  "other_recipes_in_selection": [
    {
      "recipe_key": "a73f403c578f02e4648398b5c6fe78570f1e2d3c4b5a69788796a5b4c3d2e1f0",
      "n_scans": 12
    }
  ]
}
