{
  "export_schema_version": 1,
  "generated_at": "2026-10-02T12:00:00.000Z",
  "generated_by": {
    "tool": "bloom-web",
    "version": "1.0.0"
  },
  "selection": {
    "experiment_ids": [
      1
    ],
    "scan_ids": null,
    "filters": {},
    "scan_ids_sha256": "ccc7cc77fbcb6de942a547e6ff96bd72ababc6333d3d8f706ebfdb36006079a1"
  },
  "recipe": {
    "recipe_key": "unattributed",
    "recipe_key_version": null,
    "recipe_kind": "unattributed",
    "chosen_by": "user",
    "definition": null
  },
  "included": {
    "n_scans": 1,
    "source_ids": []
  },
  "excluded": [
    {
      "scan_id": 9,
      "plant_qr_code": "FX-P1",
      "reason": "other_recipe",
      "available_recipes": [
        "1bad3d73baf3961fad971247006876e3ae551c74ca494ae1039ee267d09e25fa"
      ]
    },
    {
      "scan_id": 10,
      "plant_qr_code": "FX-P1",
      "reason": "other_recipe",
      "available_recipes": [
        "1bad3d73baf3961fad971247006876e3ae551c74ca494ae1039ee267d09e25fa"
      ]
    },
    {
      "scan_id": 100,
      "plant_qr_code": "FX-P2",
      "reason": "other_recipe",
      "available_recipes": [
        "1bad3d73baf3961fad971247006876e3ae551c74ca494ae1039ee267d09e25fa"
      ]
    },
    {
      "scan_id": 101,
      "plant_qr_code": "FX-P3",
      "reason": "other_recipe",
      "available_recipes": [
        "2dde535d26774eedab8f04f10814d33933136c41d35013e32abe39000432ba96"
      ]
    },
    {
      "scan_id": 102,
      "plant_qr_code": "FX-P4",
      "reason": "legacy_only",
      "available_recipes": [
        "legacy:9"
      ]
    },
    {
      "scan_id": 200,
      "plant_qr_code": "FX-P6",
      "reason": "no_traits",
      "available_recipes": []
    },
    {
      "scan_id": 201,
      "plant_qr_code": "FX-P7",
      "reason": "other_recipe",
      "available_recipes": [
        "2dde535d26774eedab8f04f10814d33933136c41d35013e32abe39000432ba96"
      ]
    }
  ],
  "other_recipes_in_selection": [
    {
      "recipe_key": "2dde535d26774eedab8f04f10814d33933136c41d35013e32abe39000432ba96",
      "n_scans": 2
    },
    {
      "recipe_key": "1bad3d73baf3961fad971247006876e3ae551c74ca494ae1039ee267d09e25fa",
      "n_scans": 3
    },
    {
      "recipe_key": "legacy:9",
      "n_scans": 1
    }
  ]
}
